{
  "$schema": "https://json-schema.org/draft/2020-12/schema",
  "$id": "strataos/observation.schema.json",
  "title": "Observation",
  "type": "object",
  "additionalProperties": false,
  "required": [
    "observation_id",
    "person_id",
    "opportunity_id",
    "key",
    "value",
    "source",
    "captured_at"
  ],
  "properties": {
    "observation_id": { "type": "string", "minLength": 1 },
    "person_id": { "type": "string", "minLength": 1 },
    "opportunity_id": { "type": "string", "minLength": 1 },
    "key": { "type": "string", "minLength": 1 },
    "value": {},
    "source": { "type": "string", "minLength": 1 },
    "quality": { "type": "number", "minimum": 0.0, "maximum": 1.0 },
    "captured_at": { "type": "string", "format": "date-time" }
  }
}
